{
  "manifestVersion": 1,
  "id": "01JABCDEVID0000000000000001",
  "createdAt": "2026-10-19T08:00:00Z",
  "subject": {
    "repository": "https://github.com/acme/web",
    "commit": "9b1c2d3e4f5a6b7c8d9e0f1a2b3c4d5e6f7a8b9c",
    "pullRequest": "https://github.com/acme/web/pull/7"
  },
  "runId": "01JABCDRUN00000000000000001",
  "producer": {
    "name": "proof",
    "version": "1.0.0"
  },
  "result": "passed",
  "scenarios": [
    {
      "id": "SCN-PROOF-004",
      "result": "passed",
      "artifacts": ["screenshots/checkout.png", "traces/checkout.zip"]
    }
  ],
  "artifacts": [
    {
      "path": "screenshots/checkout.png",
      "kind": "screenshot",
      "mediaType": "image/png",
      "sha256": "0000000000000000000000000000000000000000000000000000000000000000",
      "bytes": 48211
    },
    {
      "path": "traces/checkout.zip",
      "kind": "playwright-trace",
      "mediaType": "application/zip",
      "sha256": "1111111111111111111111111111111111111111111111111111111111111111"
    }
  ]
}
